{
  "$schema": "https://json-schema.org/draft/2020-12/schema",
  "$id": "https://fortisland.local/contracts/publishing/geographic_coverage.v1.schema.json",
  "title": "geographic_coverage v1",
  "type": "object",
  "additionalProperties": false,
  "required": [
    "contract_name",
    "contract_version",
    "owner",
    "refresh_cadence",
    "source_layers",
    "grain",
    "date_range",
    "state",
    "records"
  ],
  "properties": {
    "contract_name": {
      "const": "geographic_coverage"
    },
    "contract_version": {
      "const": "v1"
    },
    "owner": {
      "type": "string",
      "minLength": 1
    },
    "refresh_cadence": {
      "const": "weekly"
    },
    "grain": {
      "const": "state_county_time_window"
    },
    "source_layers": {
      "type": "array",
      "minItems": 1,
      "items": {
        "type": "string",
        "enum": [
          "canonical_property_layer"
        ]
      }
    },
    "date_range": {
      "type": "object",
      "additionalProperties": false,
      "required": [
        "start_date",
        "end_date"
      ],
      "properties": {
        "start_date": {
          "type": "string",
          "format": "date"
        },
        "end_date": {
          "type": "string",
          "format": "date"
        }
      }
    },
    "state": {
      "type": "object",
      "additionalProperties": false,
      "required": [
        "slug",
        "name",
        "state_code"
      ],
      "properties": {
        "slug": {
          "type": "string"
        },
        "name": {
          "type": "string"
        },
        "state_code": {
          "type": "string",
          "pattern": "^[A-Z]{2}$"
        }
      }
    },
    "records": {
      "type": "array",
      "minItems": 1,
      "items": {
        "type": "object",
        "additionalProperties": false,
        "required": [
          "state_slug",
          "county_slug",
          "county_name",
          "state_code",
          "fips_code",
          "period_start",
          "period_end",
          "zip_count_in_region",
          "zip_count_with_properties",
          "total_properties",
          "data_as_of",
          "last_updated_at"
        ],
        "properties": {
          "state_slug": {
            "type": "string"
          },
          "county_slug": {
            "type": "string"
          },
          "county_name": {
            "type": "string"
          },
          "state_code": {
            "type": "string",
            "pattern": "^[A-Z]{2}$"
          },
          "fips_code": {
            "type": "string",
            "pattern": "^[0-9]{5}$"
          },
          "period_start": {
            "type": "string",
            "format": "date"
          },
          "period_end": {
            "type": "string",
            "format": "date"
          },
          "zip_count_in_region": {
            "type": "integer",
            "minimum": 0
          },
          "zip_count_with_properties": {
            "type": "integer",
            "minimum": 0
          },
          "total_properties": {
            "type": "integer",
            "minimum": 0
          },
          "data_as_of": {
            "type": "string",
            "format": "date"
          },
          "last_updated_at": {
            "type": "string",
            "format": "date-time"
          }
        }
      }
    }
  }
}
