{
  "contract_name": "geographic_coverage",
  "contract_version": "v1",
  "owner": "fort_island_operator",
  "refresh_cadence": "weekly",
  "source_layers": [
    "canonical_property_layer"
  ],
  "grain": "state_county_time_window",
  "date_range": {
    "start_date": "2026-03-15",
    "end_date": "2026-04-14"
  },
  "state": {
    "slug": "massachusetts",
    "name": "Massachusetts",
    "state_code": "MA"
  },
  "records": [
    {
      "state_slug": "massachusetts",
      "county_slug": "barnstable-county-ma",
      "county_name": "Barnstable",
      "state_code": "MA",
      "fips_code": "25001",
      "period_start": "2026-03-15",
      "period_end": "2026-04-14",
      "zip_count_in_region": 15,
      "zip_count_with_properties": 12,
      "total_properties": 156,
      "data_as_of": "2026-04-14",
      "last_updated_at": "2026-04-14T12:00:00Z"
    },
    {
      "state_slug": "massachusetts",
      "county_slug": "berkshire-county-ma",
      "county_name": "Berkshire",
      "state_code": "MA",
      "fips_code": "25003",
      "period_start": "2026-03-15",
      "period_end": "2026-04-14",
      "zip_count_in_region": 24,
      "zip_count_with_properties": 19,
      "total_properties": 134,
      "data_as_of": "2026-04-14",
      "last_updated_at": "2026-04-14T12:00:00Z"
    },
    {
      "state_slug": "massachusetts",
      "county_slug": "bristol-county-ma",
      "county_name": "Bristol",
      "state_code": "MA",
      "fips_code": "25005",
      "period_start": "2026-03-15",
      "period_end": "2026-04-14",
      "zip_count_in_region": 31,
      "zip_count_with_properties": 28,
      "total_properties": 378,
      "data_as_of": "2026-04-14",
      "last_updated_at": "2026-04-14T12:00:00Z"
    },
    {
      "state_slug": "massachusetts",
      "county_slug": "dukes-county-ma",
      "county_name": "Dukes",
      "state_code": "MA",
      "fips_code": "25007",
      "period_start": "2026-03-15",
      "period_end": "2026-04-14",
      "zip_count_in_region": 6,
      "zip_count_with_properties": 4,
      "total_properties": 43,
      "data_as_of": "2026-04-14",
      "last_updated_at": "2026-04-14T12:00:00Z"
    },
    {
      "state_slug": "massachusetts",
      "county_slug": "essex-county-ma",
      "county_name": "Essex",
      "state_code": "MA",
      "fips_code": "25009",
      "period_start": "2026-03-15",
      "period_end": "2026-04-14",
      "zip_count_in_region": 42,
      "zip_count_with_properties": 38,
      "total_properties": 487,
      "data_as_of": "2026-04-14",
      "last_updated_at": "2026-04-14T12:00:00Z"
    },
    {
      "state_slug": "massachusetts",
      "county_slug": "franklin-county-ma",
      "county_name": "Franklin",
      "state_code": "MA",
      "fips_code": "25011",
      "period_start": "2026-03-15",
      "period_end": "2026-04-14",
      "zip_count_in_region": 26,
      "zip_count_with_properties": 18,
      "total_properties": 89,
      "data_as_of": "2026-04-14",
      "last_updated_at": "2026-04-14T12:00:00Z"
    },
    {
      "state_slug": "massachusetts",
      "county_slug": "hampden-county-ma",
      "county_name": "Hampden",
      "state_code": "MA",
      "fips_code": "25013",
      "period_start": "2026-03-15",
      "period_end": "2026-04-14",
      "zip_count_in_region": 27,
      "zip_count_with_properties": 22,
      "total_properties": 298,
      "data_as_of": "2026-04-14",
      "last_updated_at": "2026-04-14T12:00:00Z"
    },
    {
      "state_slug": "massachusetts",
      "county_slug": "hampshire-county-ma",
      "county_name": "Hampshire",
      "state_code": "MA",
      "fips_code": "25015",
      "period_start": "2026-03-15",
      "period_end": "2026-04-14",
      "zip_count_in_region": 24,
      "zip_count_with_properties": 20,
      "total_properties": 187,
      "data_as_of": "2026-04-14",
      "last_updated_at": "2026-04-14T12:00:00Z"
    },
    {
      "state_slug": "massachusetts",
      "county_slug": "middlesex-county-ma",
      "county_name": "Middlesex",
      "state_code": "MA",
      "fips_code": "25017",
      "period_start": "2026-03-15",
      "period_end": "2026-04-14",
      "zip_count_in_region": 54,
      "zip_count_with_properties": 51,
      "total_properties": 1247,
      "data_as_of": "2026-04-14",
      "last_updated_at": "2026-04-14T12:00:00Z"
    },
    {
      "state_slug": "massachusetts",
      "county_slug": "nantucket-county-ma",
      "county_name": "Nantucket",
      "state_code": "MA",
      "fips_code": "25019",
      "period_start": "2026-03-15",
      "period_end": "2026-04-14",
      "zip_count_in_region": 2,
      "zip_count_with_properties": 2,
      "total_properties": 28,
      "data_as_of": "2026-04-14",
      "last_updated_at": "2026-04-14T12:00:00Z"
    },
    {
      "state_slug": "massachusetts",
      "county_slug": "norfolk-county-ma",
      "county_name": "Norfolk",
      "state_code": "MA",
      "fips_code": "25021",
      "period_start": "2026-03-15",
      "period_end": "2026-04-14",
      "zip_count_in_region": 28,
      "zip_count_with_properties": 26,
      "total_properties": 634,
      "data_as_of": "2026-04-14",
      "last_updated_at": "2026-04-14T12:00:00Z"
    },
    {
      "state_slug": "massachusetts",
      "county_slug": "plymouth-county-ma",
      "county_name": "Plymouth",
      "state_code": "MA",
      "fips_code": "25023",
      "period_start": "2026-03-15",
      "period_end": "2026-04-14",
      "zip_count_in_region": 32,
      "zip_count_with_properties": 27,
      "total_properties": 412,
      "data_as_of": "2026-04-14",
      "last_updated_at": "2026-04-14T12:00:00Z"
    },
    {
      "state_slug": "massachusetts",
      "county_slug": "suffolk-county-ma",
      "county_name": "Suffolk",
      "state_code": "MA",
      "fips_code": "25025",
      "period_start": "2026-03-15",
      "period_end": "2026-04-14",
      "zip_count_in_region": 13,
      "zip_count_with_properties": 13,
      "total_properties": 521,
      "data_as_of": "2026-04-14",
      "last_updated_at": "2026-04-14T12:00:00Z"
    },
    {
      "state_slug": "massachusetts",
      "county_slug": "worcester-county-ma",
      "county_name": "Worcester",
      "state_code": "MA",
      "fips_code": "25027",
      "period_start": "2026-03-15",
      "period_end": "2026-04-14",
      "zip_count_in_region": 40,
      "zip_count_with_properties": 35,
      "total_properties": 892,
      "data_as_of": "2026-04-14",
      "last_updated_at": "2026-04-14T12:00:00Z"
    }
  ]
}
